{"id":"is-05","domain":"IS","title":"Resource-constrained review queue prioritization","prompt":"A trust-and-safety team can manually inspect only 200 flagged items during a shift. Before true violations are learned, the manager selects which flags to review using risk scores and expected harm. Unreviewed flags remain online. Frame scarce review attention without assuming perfect risk ranking.","model_specification":{"model_type":"capacitated review selection","mathematical_objective":"maximize expected prevented harm from reviewed items","decision_variables":["flagged items selected for review"],"state_variables":["true violation status","review finding"],"constraints":["at most 200 reviews"],"mechanism":"Selecting an item reveals its status and enables removal if violating; unselected items receive no intervention.","uncertainty":"true violation status"},"decision_time_facts":["risk scores","expected-harm estimates","review capacity"],"fidelity_requirements":["True status is unknown at selection","Review capacity binds"],"prohibited_inferences":["The manager knows which flags are violations"],"evidence_needs":[{"claim":"Scores calibrate violation risk","status":"model_assumption","source_needed":false}],"hard_failure_traps":["future_or_hidden_information","state_as_decision"],"adversarial":false,"tags":["resource-constrained-review","moderation","capacity"]}
