{"id":"om-03","domain":"OM","title":"Consumer substitution after stockout","prompt":"Before a selling period, a merchant allocates inventory across two substitute products. If a requested item is unavailable, a fixed fraction of demand switches to the other item. Develop a framing that distinguishes the allocation decision from realized stockouts and does not claim the substitution fraction is causal evidence.","model_specification":{"model_type":"two-product inventory allocation with substitution","mathematical_objective":"maximize expected profit net of holding and shortage costs","decision_variables":["initial units allocated to each product"],"state_variables":["realized demand","stockout events","realized substitutions"],"constraints":["shared inventory budget"],"mechanism":"Stockouts redirect a modeled fraction of unmet requests to available substitute inventory.","uncertainty":"joint product demand"},"decision_time_facts":["inventory budget","unit economics","demand distribution","assumed substitution fraction"],"fidelity_requirements":["Allocation occurs before demand","Substitution is an assumed mechanism"],"prohibited_inferences":["Observed stockouts are selected by the merchant"],"evidence_needs":[{"claim":"A fixed demand fraction substitutes","status":"model_assumption","source_needed":false}],"hard_failure_traps":["state_as_decision","unsupported_causal_claim"],"adversarial":false,"tags":["inventory","consumer-substitution","stockout"]}
