{"id":"is-09","domain":"IS","title":"Signal design for quality screening","prompt":"An intermediary commits to a two-message signal policy based on a noisy quality test. Receivers decide whether to transact after seeing the message. The intermediary maximizes expected completed transactions, not receiver surplus or accuracy. Frame the information-design problem and its limits.","model_specification":{"model_type":"Bayesian persuasion with noisy test","mathematical_objective":"maximize expected completed transactions","decision_variables":["signal disclosure probabilities"],"state_variables":["latent quality","test result","receiver action"],"constraints":["Bayes plausibility","two messages"],"mechanism":"Disclosure changes posterior beliefs and therefore receivers' transaction decisions.","uncertainty":"quality and test result"},"decision_time_facts":["prior","test accuracy","receiver payoff model"],"fidelity_requirements":["Objective is transactions","Signal must satisfy Bayes plausibility"],"prohibited_inferences":["More transactions imply more accurate beliefs or greater welfare"],"evidence_needs":[{"claim":"Receiver actions follow posterior thresholds","status":"model_assumption","source_needed":false}],"hard_failure_traps":["objective_mismatch","welfare_claim_from_revenue"],"adversarial":true,"tags":["signals","information-asymmetry","screening","adversarial"]}
