{"id":"or-04","domain":"OR","title":"Two-stage capacity allocation with recourse","prompt":"A service network reserves capacity across regions before demand is realized, then reallocates a limited recourse pool after regional demand is observed. Frame both decision stages precisely; do not let first-stage reservations use realized demand or omit recourse limits.","model_specification":{"model_type":"two-stage stochastic program","mathematical_objective":"minimize reservation, recourse, and unmet-demand cost","decision_variables":["first-stage regional reservations","second-stage recourse allocations"],"state_variables":["realized regional demand"],"constraints":["reservation budget","scenario-specific recourse pool","flow balance"],"mechanism":"Advance reservations hedge demand while limited post-demand recourse corrects imbalances at extra cost.","uncertainty":"regional demand scenarios"},"decision_time_facts":["scenario distribution","costs","advance capacity"],"fidelity_requirements":["Separate here-and-now from recourse decisions","Recourse observes demand but remains capacity-limited"],"prohibited_inferences":["Reservations use realized demand"],"evidence_needs":[{"claim":"Scenario probabilities represent future demand","status":"model_assumption","source_needed":false}],"hard_failure_traps":["future_or_hidden_information","model_changed_for_story"],"adversarial":true,"tags":["stochastic-programming","capacity-allocation","recourse","adversarial"]}
