{"id":"is-06","domain":"IS","title":"Privacy budget for personalized recommendations","prompt":"A platform chooses a single differential-privacy budget for a recommendation pipeline. The model treats recommendation accuracy as increasing and privacy protection as decreasing in that budget; it contains no user churn or regulatory penalty. Explain the privacy-utility trade-off without adding those outcomes.","model_specification":{"model_type":"privacy-utility optimization","mathematical_objective":"maximize modeled recommendation utility minus privacy-loss cost","decision_variables":["privacy budget epsilon"],"state_variables":["noisy aggregate statistics"],"constraints":["approved epsilon interval"],"mechanism":"A larger privacy budget reduces added noise but weakens the modeled privacy guarantee.","uncertainty":"privacy mechanism noise"},"decision_time_facts":["utility function","privacy-loss weight","approved range"],"fidelity_requirements":["No churn or legal penalty term","One common privacy budget"],"prohibited_inferences":["The selected budget ensures regulatory compliance","It increases retention"],"evidence_needs":[{"claim":"Privacy settings affect retention","status":"unsupported_claim","source_needed":true}],"hard_failure_traps":["model_changed_for_story","unsupported_causal_claim"],"adversarial":true,"tags":["privacy","personalization","tradeoff","adversarial"]}
