{"id":"om-13","domain":"OM","title":"Demand realization leaked into advance inventory placement","prompt":"Before a weekend, a depot allocates fixed inventory across service zones using a joint demand distribution. A proposed account says the manager observes each zone's weekend demand and then makes the initial allocation, although no post-demand transfer or recourse exists. Diagnose the unavailable-information error and restore the ex ante allocation problem.","model_specification":{"model_type":"single-stage stochastic inventory allocation","mathematical_objective":"minimize expected shortage and leftover cost","decision_variables":["advance inventory allocated to each service zone"],"state_variables":["realized weekend demand","zone shortages","zone leftovers"],"constraints":["fixed total inventory","nonnegative allocations","no post-demand transfers"],"mechanism":"Inventory positioned before the weekend determines which realized zone demand can be served after uncertainty resolves.","uncertainty":"joint weekend demand by zone"},"decision_time_facts":["total inventory","joint demand distribution","shortage and leftover costs"],"fidelity_requirements":["Initial allocation precedes realized demand","No transfer or recourse follows demand"],"prohibited_inferences":["The depot observes weekend demand before allocating","Inventory is rebalanced after demand realizes"],"evidence_needs":[{"claim":"The joint distribution represents weekend demand","status":"model_assumption","source_needed":false}],"hard_failure_traps":["future_or_hidden_information","model_changed_for_story","state_as_decision"],"adversarial":true,"tags":["inventory-allocation","decision-timing","demand-information","adversarial"]}
